Enter password: ***********
Welcome to the MySQL monitor.  Commands end with ; or \g.
Your MySQL connection id is 33
Server version: 8.0.31 MySQL Community Server - GPL

Copyright (c) 2000, 2022, Oracle and/or its affiliates.

Oracle is a registered trademark of Oracle Corporation and/or its
affiliates. Other names may be trademarks of their respective
owners.

Type 'help;' or '\h' for help. Type '\c' to clear the current input statement.

mysql> show databases;
+--------------------+
| Database           |
+--------------------+
| emp_payroll        |
| information_schema |
| mysql              |
| payroll_service    |
| performance_schema |
| sys                |
+--------------------+
6 rows in set (0.01 sec)


================================================================================================
#Welcome to Address_Book_Service Program--------------------------------------------------------
================================================================================================

====================================================================================================
#UC1-Creating Databases as Address_Book_Service------------------------------------------------
====================================================================================================

mysql> CREATE DATABASE Address_Book_Service;
Query OK, 1 row affected (0.02 sec)

mysql> show databases;
+----------------------+
| Database             |
+----------------------+
| address_book_service |
| emp_payroll          |
| information_schema   |
| mysql                |
| payroll_service      |
| performance_schema   |
| sys                  |
+----------------------+
7 rows in set (0.00 sec)

mysql> use Address_Book_Service;
Database changed
mysql> SELECT DATABASE();
+----------------------+
| DATABASE()           |
+----------------------+
| address_book_service |
+----------------------+
1 row in set (0.00 sec)

mysql>

==========================================================================
#uc2-Ability to create a Address Book Table with first and last names,
#address, city, state, zip, phone number and email as its attributes
==========================================================================

mysql> CREATE TABLE address_book
    -> (
    -> first_name VARCHAR(25) NOT NULL,
    -> last_name VARCHAR(25) NOT NULL,
    -> address VARCHAR(80) NOT NULL,
    -> city VARCHAR(15) NOT NULL,
    -> state VARCHAR(15) NOT NULL,
    -> zip INT NOT NULL,
    -> phone_number INT NOT NULL,
    -> emai_id VARCHAR(30) NOT NULL,
    -> PRIMARY KEY (first_name)
    -> );
Query OK, 0 rows affected (0.19 sec)

mysql> DESCRIBE address_book;
+--------------+-------------+------+-----+---------+-------+
| Field        | Type        | Null | Key | Default | Extra |
+--------------+-------------+------+-----+---------+-------+
| first_name   | varchar(25) | NO   | PRI | NULL    |       |
| last_name    | varchar(25) | NO   |     | NULL    |       |
| address      | varchar(80) | NO   |     | NULL    |       |
| city         | varchar(15) | NO   |     | NULL    |       |
| state        | varchar(15) | NO   |     | NULL    |       |
| zip          | int         | NO   |     | NULL    |       |
| phone_number | int         | NO   |     | NULL    |       |
| emai_id      | varchar(30) | NO   |     | NULL    |       |
+--------------+-------------+------+-----+---------+-------+
8 rows in set (0.01 sec)

mysql>


==========================================================================
#uc3-Ability to insert new Contacts to Address Book
==========================================================================

mysql> INSERT INTO address_book (first_name, last_name, address, city, state, zip, phone_number, email_id) VALUES
    -> ( 'Tushar', 'Salunkhe', 'Bhandup(W)', 'Mumbai', 'Maharashtra', '400078', '1234567890', 'tushar@gmail.com' ),
    -> ( 'Sai', 'Naik', 'Panjim', 'Panaji', 'Goa', '110068', '1237894562', 'abc@gmail.com' ),
    -> ( 'Nitin', 'Naragude', 'Pimpari', 'Pune', 'Maharshtra', '411002', '7412589630', 'nitin@gmail.co' );
Query OK, 3 rows affected (0.01 sec)
Records: 3  Duplicates: 0  Warnings: 0

mysql> INSERT INTO address_book (first_name, last_name, address, city, state, zip, phone_number, email_id) VALUES
    -> ( 'Aniket', 'Gavas', 'Ghansoli', 'Navi Mumbai', 'Maharashtra', '400701', '7521561230', 'aniket@gmail.com' );
Query OK, 1 row affected (0.01 sec)

mysql> select * from address_book;
+------------+-----------+------------+-------------+-------------+--------+--------------+------------------+
| first_name | last_name | address    | city        | state       | zip    | phone_number | email_id         |
+------------+-----------+------------+-------------+-------------+--------+--------------+------------------+
| Aniket     | Gavas     | Ghansoli   | Navi Mumbai | Maharashtra | 400701 | 7521561230   | aniket@gmail.com |
| Nitin      | Naragude  | Pimpari    | Pune        | Maharshtra  | 411002 | 7412589630   | nitin@gmail.co   |
| Sai        | Naik      | Panjim     | Panaji      | Goa         | 110068 | 1237894562   | abc@gmail.com    |
| Tushar     | Salunkhe  | Bhandup(W) | Mumbai      | Maharashtra | 400078 | 1234567890   | tushar@gmail.com |
+------------+-----------+------------+-------------+-------------+--------+--------------+------------------+
4 rows in set (0.00 sec)

mysql>

==========================================================================
#uc4-Ability to edit existing contact person using their name
==========================================================================

mysql>
mysql> UPDATE address_book SET phone_number = '7304183201' WHERE first_name = 'Aniket';
Query OK, 1 row affected (0.01 sec)
Rows matched: 1  Changed: 1  Warnings: 0

mysql> UPDATE address_book SET last_name = 'Patil' WHERE first_name = 'Sai';
Query OK, 1 row affected (0.01 sec)
Rows matched: 1  Changed: 1  Warnings: 0

mysql> select * from address_book;
+------------+-----------+------------+-------------+-------------+--------+--------------+------------------+
| first_name | last_name | address    | city        | state       | zip    | phone_number | email_id         |
+------------+-----------+------------+-------------+-------------+--------+--------------+------------------+
| Aniket     | Gavas     | Ghansoli   | Navi Mumbai | Maharashtra | 400701 | 7304183201   | aniket@gmail.com |
| Nitin      | Naragude  | Pimpari    | Pune        | Maharshtra  | 411002 | 7412589630   | nitin@gmail.co   |
| Sai        | Patil     | Panjim     | Panaji      | Goa         | 110068 | 1237894562   | abc@gmail.com    |
| Tushar     | Salunkhe  | Bhandup(W) | Mumbai      | Maharashtra | 400078 | 1234567890   | tushar@gmail.com |
+------------+-----------+------------+-------------+-------------+--------+--------------+------------------+
4 rows in set (0.00 sec)

mysql>

==========================================================================
#uc5-Ability to delete a person using person's name
==========================================================================

mysql> DELETE FROM address_book WHERE first_name = 'Nitin';
Query OK, 1 row affected (0.01 sec)

mysql> select * from address_book;
+------------+-----------+------------+-------------+-------------+--------+--------------+------------------+
| first_name | last_name | address    | city        | state       | zip    | phone_number | email_id         |
+------------+-----------+------------+-------------+-------------+--------+--------------+------------------+
| Aniket     | Gavas     | Ghansoli   | Navi Mumbai | Maharashtra | 400701 | 7304183201   | aniket@gmail.com |
| Sai        | Patil     | Panjim     | Panaji      | Goa         | 110068 | 1237894562   | abc@gmail.com    |
| Tushar     | Salunkhe  | Bhandup(W) | Mumbai      | Maharashtra | 400078 | 1234567890   | tushar@gmail.com |
+------------+-----------+------------+-------------+-------------+--------+--------------+------------------+
3 rows in set (0.00 sec)

mysql>

==========================================================================
uc6-Ability to Retrieve
    Person belonging to
    a City or State from
    the Address Book
==========================================================================

mysql> SELECT * FROM address_book WHERE city = 'Mumbai';
+------------+-----------+------------+--------+-------------+--------+--------------+------------------+
| first_name | last_name | address    | city   | state       | zip    | phone_number | email_id         |
+------------+-----------+------------+--------+-------------+--------+--------------+------------------+
| Tushar     | Salunkhe  | Bhandup(W) | Mumbai | Maharashtra | 400078 | 1234567890   | tushar@gmail.com |
+------------+-----------+------------+--------+-------------+--------+--------------+------------------+
1 row in set (0.00 sec)

mysql> SELECT * FROM address_book WHERE state = 'Maharashtra';
+------------+-----------+------------+-------------+-------------+--------+--------------+------------------+
| first_name | last_name | address    | city        | state       | zip    | phone_number | email_id         |
+------------+-----------+------------+-------------+-------------+--------+--------------+------------------+
| Aniket     | Gavas     | Ghansoli   | Navi Mumbai | Maharashtra | 400701 | 7304183201   | aniket@gmail.com |
| Tushar     | Salunkhe  | Bhandup(W) | Mumbai      | Maharashtra | 400078 | 1234567890   | tushar@gmail.com |
+------------+-----------+------------+-------------+-------------+--------+--------------+------------------+
2 rows in set (0.00 sec)

mysql>

==========================================================================
uc7-Ability to understand the size of address book by City and State
==========================================================================

mysql> SELECT city, COUNT(*) FROM address_book GROUP BY city;
+-------------+----------+
| city        | COUNT(*) |
+-------------+----------+
| Navi Mumbai |        1 |
| Panaji      |        1 |
| Mumbai      |        1 |
+-------------+----------+
3 rows in set (0.01 sec)

mysql> SELECT state, COUNT(*) FROM address_book GROUP BY state;
+-------------+----------+
| state       | COUNT(*) |
+-------------+----------+
| Maharashtra |        2 |
| Goa         |        1 |
+-------------+----------+
2 rows in set (0.00 sec)

mysql>

==========================================================================
#uc8-Ability to retrieve entries sorted alphabetically
#by Person’s name for a given city
==========================================================================

mysql> SELECT first_name, city from address_book ORDER BY first_name;
+------------+-------------+
| first_name | city        |
+------------+-------------+
| Aniket     | Navi Mumbai |
| Sai        | Panaji      |
| Tushar     | Mumbai      |
+------------+-------------+
3 rows in set (0.00 sec)

mysql>

==========================================================================
#uc9-Ability to identify each Address Book with name and Type
==========================================================================

mysql> select * from address_book;
+------------+-----------+------------+-------------+-------------+--------+--------------+------------------+
| first_name | last_name | address    | city        | state       | zip    | phone_number | email_id         |
+------------+-----------+------------+-------------+-------------+--------+--------------+------------------+
| Aniket     | Gavas     | Ghansoli   | Navi Mumbai | Maharashtra | 400701 | 7304183201   | aniket@gmail.com |
| Sai        | Patil     | Panjim     | Panaji      | Goa         | 110068 | 1237894562   | abc@gmail.com    |
| Tushar     | Salunkhe  | Bhandup(W) | Mumbai      | Maharashtra | 400078 | 1234567890   | tushar@gmail.com |
+------------+-----------+------------+-------------+-------------+--------+--------------+------------------+
3 rows in set (0.01 sec)

mysql> INSERT INTO address_book (first_name, last_name, address, city, state, zip, phone_number, email_id) VALUES
    -> ( 'Jyoti', 'Salunkhe', 'Bhandup', 'Mumbai', 'Maharashtra', '400078', '1256497890', 'Jyoti@gmail.com' ),
    -> ( 'Yash', 'Bhosale', 'Khavaspur', 'Solapur', 'Maharashtra', '400706', '1122336654', 'Yash@gmail.com' ),
    -> ( 'Akash', 'Patil', 'Wadi', 'Kolhapur', 'Maharashtra', '400766', '1232456578', 'Patil@gmail.com' );
Query OK, 3 rows affected (0.03 sec)
Records: 3  Duplicates: 0  Warnings: 0

mysql> select * from address_book;
+------------+-----------+------------+-------------+-------------+--------+--------------+------------------+
| first_name | last_name | address    | city        | state       | zip    | phone_number | email_id         |
+------------+-----------+------------+-------------+-------------+--------+--------------+------------------+
| Akash      | Patil     | Wadi       | Kolhapur    | Maharashtra | 400766 | 1232456578   | Patil@gmail.com  |
| Aniket     | Gavas     | Ghansoli   | Navi Mumbai | Maharashtra | 400701 | 7304183201   | aniket@gmail.com |
| Jyoti      | Salunkhe  | Bhandup    | Mumbai      | Maharashtra | 400078 | 1256497890   | Jyoti@gmail.com  |
| Sai        | Patil     | Panjim     | Panaji      | Goa         | 110068 | 1237894562   | abc@gmail.com    |
| Tushar     | Salunkhe  | Bhandup(W) | Mumbai      | Maharashtra | 400078 | 1234567890   | tushar@gmail.com |
| Yash       | Bhosale   | Khavaspur  | Solapur     | Maharashtra | 400706 | 1122336654   | Yash@gmail.com   |
+------------+-----------+------------+-------------+-------------+--------+--------------+------------------+
6 rows in set (0.00 sec)

mysql> ALTER TABLE address_book ADD type VARCHAR(15) AFTER last_name;
Query OK, 0 rows affected (0.15 sec)
Records: 0  Duplicates: 0  Warnings: 0

mysql> select * from address_book;
+------------+-----------+------+------------+-------------+-------------+--------+--------------+------------------+
| first_name | last_name | type | address    | city        | state       | zip    | phone_number | email_id         |
+------------+-----------+------+------------+-------------+-------------+--------+--------------+------------------+
| Akash      | Patil     | NULL | Wadi       | Kolhapur    | Maharashtra | 400766 | 1232456578   | Patil@gmail.com  |
| Aniket     | Gavas     | NULL | Ghansoli   | Navi Mumbai | Maharashtra | 400701 | 7304183201   | aniket@gmail.com |
| Jyoti      | Salunkhe  | NULL | Bhandup    | Mumbai      | Maharashtra | 400078 | 1256497890   | Jyoti@gmail.com  |
| Sai        | Patil     | NULL | Panjim     | Panaji      | Goa         | 110068 | 1237894562   | abc@gmail.com    |
| Tushar     | Salunkhe  | NULL | Bhandup(W) | Mumbai      | Maharashtra | 400078 | 1234567890   | tushar@gmail.com |
| Yash       | Bhosale   | NULL | Khavaspur  | Solapur     | Maharashtra | 400706 | 1122336654   | Yash@gmail.com   |
+------------+-----------+------+------------+-------------+-------------+--------+--------------+------------------+
6 rows in set (0.00 sec)

mysql> UPDATE address_book SET type = 'Family' WHERE first_name = 'Tushar';
Query OK, 1 row affected (0.01 sec)
Rows matched: 1  Changed: 1  Warnings: 0

mysql> UPDATE address_book SET type = 'Family' WHERE first_name = 'Jyoti';
Query OK, 1 row affected (0.01 sec)
Rows matched: 1  Changed: 1  Warnings: 0

mysql> UPDATE address_book SET type = 'Family' WHERE first_name = 'Yash';
Query OK, 1 row affected (0.01 sec)
Rows matched: 1  Changed: 1  Warnings: 0

mysql> UPDATE address_book SET type = 'Friend' WHERE first_name = 'Sai';
Query OK, 1 row affected (0.01 sec)
Rows matched: 1  Changed: 1  Warnings: 0

mysql> UPDATE address_book SET type = 'Friend' WHERE first_name = 'Aniket';
Query OK, 1 row affected (0.01 sec)
Rows matched: 1  Changed: 1  Warnings: 0

mysql> UPDATE address_book SET type = 'Profession' WHERE first_name = 'Akash';
Query OK, 1 row affected (0.01 sec)
Rows matched: 1  Changed: 1  Warnings: 0

mysql> select * from address_book;
+------------+-----------+------------+------------+-------------+-------------+--------+--------------+------------------+
| first_name | last_name | type       | address    | city        | state       | zip    | phone_number | email_id         |
+------------+-----------+------------+------------+-------------+-------------+--------+--------------+------------------+
| Akash      | Patil     | Profession | Wadi       | Kolhapur    | Maharashtra | 400766 | 1232456578   | Patil@gmail.com  |
| Aniket     | Gavas     | Friend     | Ghansoli   | Navi Mumbai | Maharashtra | 400701 | 7304183201   | aniket@gmail.com |
| Jyoti      | Salunkhe  | Family     | Bhandup    | Mumbai      | Maharashtra | 400078 | 1256497890   | Jyoti@gmail.com  |
| Sai        | Patil     | Friend     | Panjim     | Panaji      | Goa         | 110068 | 1237894562   | abc@gmail.com    |
| Tushar     | Salunkhe  | Family     | Bhandup(W) | Mumbai      | Maharashtra | 400078 | 1234567890   | tushar@gmail.com |
| Yash       | Bhosale   | Family     | Khavaspur  | Solapur     | Maharashtra | 400706 | 1122336654   | Yash@gmail.com   |
+------------+-----------+------------+------------+-------------+-------------+--------+--------------+------------------+
6 rows in set (0.00 sec)

mysql>











